{
  "id": "A-job",
  "version": "draft-0.1",
  "title": "취업과 실패",
  "name": "민서",
  "summary": "탈락이 두려워 지원을 미루고 있어요",
  "automatic_thought": "떨어지면 나는 능력이 없는 사람이야.",
  "emotion_behavior": "불안, 지원 미루기",
  "facts": [
    "작년 하반기 서류에서 두 번 떨어짐",
    "과제 평가는 좋은 편",
    "이번 달 마감인 채용 공고 세 곳을 저장만 해 두고 지원하지 않음",
    "지원서를 쓰려고 하면 불안해서 다른 일을 먼저 하게 됨",
    "같이 준비하던 친구는 여러 곳에 지원해 한 곳에서 면접 연락을 받음",
    "인턴 때 맡은 업무로 팀장에게 칭찬을 들은 적이 있음",
    "가족은 '일단 넣어 보라'고 말함"
  ],
  "dialogue": {
    "mode": "script",
    "intro": "안녕하세요. 저는 취업 준비를 하고 있는데요… 요즘 지원서를 내는 게 너무 어려워요. 이야기를 좀 들어 주실래요?",
    "turns": [
      {
        "turn": 1,
        "choices": [
          {
            "id": "A1a",
            "text": "요즘 어떤 상황이에요?",
            "reply": "취업 준비 중이에요. 이번 달에 마감되는 공고가 세 개나 있는데… 저장만 해 두고 아직 하나도 지원을 못 했어요.",
            "fact_ids": [
              2
            ]
          },
          {
            "id": "A1b",
            "text": "지금 기분이 어때요?",
            "reply": "솔직히 많이 불안해요. 지원서를 쓰려고만 하면 불안해져서, 자꾸 다른 일부터 하게 돼요.",
            "fact_ids": [
              3
            ]
          },
          {
            "id": "A1c",
            "text": "최근에 무슨 일이 있었어요?",
            "reply": "같이 준비하던 친구가 여러 곳에 지원했는데, 그중 한 곳에서 면접 연락을 받았대요. 저는 아직 시작도 못 했는데… 마음이 복잡했어요.",
            "fact_ids": [
              4
            ]
          }
        ]
      },
      {
        "turn": 2,
        "choices": [
          {
            "id": "A2a",
            "text": "왜 지원을 미루게 되는 것 같아요?",
            "reply": "작년 하반기에 서류에서 두 번 떨어졌거든요. 또 그럴까 봐 겁이 나서 손이 안 가요.",
            "fact_ids": [
              0
            ]
          },
          {
            "id": "A2b",
            "text": "예전에 잘 해냈던 경험도 있어요?",
            "reply": "과제 평가는 좋은 편이었어요. 인턴 때 맡은 일로 팀장님께 칭찬받은 적도 있고요. 그런데… 그게 취업이랑은 다른 얘기 같아요.",
            "fact_ids": [
              1,
              5
            ]
          },
          {
            "id": "A2c",
            "text": "주변 사람들은 뭐라고 해요?",
            "reply": "가족들은 일단 넣어 보라고 해요. 그 말이 맞는 건 알겠는데… 선뜻 손이 안 가요.",
            "fact_ids": [
              6
            ]
          }
        ]
      },
      {
        "turn": 3,
        "choices": [
          {
            "id": "A3a",
            "text": "지원하려고 할 때 어떤 생각이 들어요?",
            "reply": "지원서를 쓰려고 하면 이런 생각이 들어요. '떨어지면 나는 능력이 없는 사람이야.' 그러면 그냥 창을 닫게 돼요.",
            "fact_ids": []
          },
          {
            "id": "A3b",
            "text": "가장 걱정되는 게 뭐예요?",
            "reply": "또 떨어지는 게 제일 무서워요. 떨어지면 나는 능력이 없는 사람이야… 그렇게 결론이 날 것 같아서요.",
            "fact_ids": []
          },
          {
            "id": "A3c",
            "text": "어떻게 되면 좋겠어요?",
            "reply": "저도 마음 편하게 지원해 보고 싶어요. 그런데 자꾸 '떨어지면 나는 능력이 없는 사람이야'라는 생각이 먼저 들어요.",
            "fact_ids": []
          }
        ]
      }
    ],
    "closing": "제가 어떻게 생각하면 좋을까요?"
  },
  "persona": {
    "prompt": "persona@v1",
    "style": "짧고 망설이는 말투"
  }
}
