{
  "id": "C-perfection",
  "version": "draft-0.1",
  "title": "완벽주의와 미루기",
  "name": "서윤",
  "summary": "완벽하게 하려다 과제를 시작하지 못하고 있어요",
  "automatic_thought": "완벽하게 못 하면 시작할 의미가 없어.",
  "emotion_behavior": "압박감, 과제 미루기",
  "facts": [
    "다음 주 금요일이 마감인 조별 과제 보고서에서 맡은 부분을 아직 한 줄도 쓰지 못함",
    "자료 조사만 2주째 하고 있음",
    "첫 문장을 썼다가 마음에 들지 않아 여러 번 지움",
    "지난 학기에 서둘러 낸 과제가 생각보다 좋은 점수를 받음",
    "조원들이 진행 상황을 묻는 메시지에 아직 답하지 못함",
    "과제를 떠올리면 가슴이 답답하고 압박감이 듦",
    "교수님은 초안을 먼저 보여 주면 피드백을 주겠다고 함"
  ],
  "dialogue": {
    "mode": "script",
    "intro": "안녕하세요. 과제를 해야 하는데… 도무지 시작을 못 하겠어요. 제 얘기 좀 들어 주실래요?",
    "turns": [
      {
        "turn": 1,
        "choices": [
          {
            "id": "C1a",
            "text": "요즘 어떤 상황이에요?",
            "reply": "조별 과제 보고서에서 제가 맡은 부분이 있는데, 다음 주 금요일이 마감이에요. 그런데 아직 한 줄도 못 썼어요.",
            "fact_ids": [
              0
            ]
          },
          {
            "id": "C1b",
            "text": "지금 기분이 어때요?",
            "reply": "과제 생각만 하면 가슴이 답답해요. 압박감이 너무 커서 아무것도 손에 안 잡혀요.",
            "fact_ids": [
              5
            ]
          },
          {
            "id": "C1c",
            "text": "최근에 무슨 일이 있었어요?",
            "reply": "조원들이 진행 상황을 묻는 메시지를 보냈는데, 아직 답을 못 했어요. 보여 줄 게 없어서요.",
            "fact_ids": [
              4
            ]
          }
        ]
      },
      {
        "turn": 2,
        "choices": [
          {
            "id": "C2a",
            "text": "왜 시작이 어려운 것 같아요?",
            "reply": "자료 조사만 벌써 2주째예요. 첫 문장을 써 봤는데 마음에 안 들어서 몇 번이나 지웠어요.",
            "fact_ids": [
              1,
              2
            ]
          },
          {
            "id": "C2b",
            "text": "예전에 비슷한 경험이 있었어요?",
            "reply": "지난 학기에 서둘러 낸 과제가 있었는데, 생각보다 점수가 좋았어요. 그래도… 그건 운이 좋았던 것 같아요.",
            "fact_ids": [
              3
            ]
          },
          {
            "id": "C2c",
            "text": "주변 사람들은 뭐라고 해요?",
            "reply": "교수님은 초안을 먼저 보여 주면 피드백을 주시겠대요. 그런데 덜 된 걸 보여 드리는 게 망설여져요.",
            "fact_ids": [
              6
            ]
          }
        ]
      },
      {
        "turn": 3,
        "choices": [
          {
            "id": "C3a",
            "text": "과제를 시작하려고 할 때 어떤 생각이 들어요?",
            "reply": "책상에 앉으면 '완벽하게 못 하면 시작할 의미가 없어.' 이런 생각이 들어요. 그러면 다시 자료만 찾게 돼요.",
            "fact_ids": []
          },
          {
            "id": "C3b",
            "text": "가장 걱정되는 게 뭐예요?",
            "reply": "어설픈 결과물을 내는 게 제일 걱정돼요. 완벽하게 못 하면 시작할 의미가 없어… 계속 그렇게 느껴져요.",
            "fact_ids": []
          },
          {
            "id": "C3c",
            "text": "어떻게 되면 좋겠어요?",
            "reply": "저도 일단 시작은 해 보고 싶어요. 그런데 '완벽하게 못 하면 시작할 의미가 없어'라는 생각이 발목을 잡아요.",
            "fact_ids": []
          }
        ]
      }
    ],
    "closing": "제가 어떻게 생각하면 좋을까요?"
  },
  "persona": {
    "prompt": "persona@v1",
    "style": "조급하고 스스로를 다그치는 말투"
  }
}
